DisplayName,Description,Minimum,Maximum,SortID,DisplayType,Increment,DisplayFormat,InternalType,EditFlags
Distance to be transparent (m),Near Fade minimum distance (m): Distance where α = 0,0,9999,4,f32,1,%f,f32,Wrap
Distance that begins to become transparent (m),Near fade maximum distance (m): Starting distance between α = Middel Alpha,0,9999,3,f32,1,%f,f32,Wrap
Distance to become translucent (m),Minimum distance of Far fade (m): End distance between α = Middle Alpha,0,9999,1,f32,1,%f,f32,Wrap
Distance (m) at which it begins to become translucent,Maximum Far Fade Distance (m): Distance where α = 1,0,9999,0,f32,1,%f,f32,Wrap
Translucent darkness (α value),Intermediate α value,0,1,2,f32,0.01,%f,f32,Wrap
dummy,,,,7,dummy8,,,dummy8,None
